{"current":{"active":true,"author_me_id":"dm:being:v1:AAAAAAAAAAAAAAAAAAAAAAAAAAAAAAAAAAAAAAAAAAA","category":"personal-insight","head":{"event_hash":"04912db95412c529e5dcdd57134568842f9a019f3da8460f325cd2558a030371","event_id":"d4747655-8c05-5935-810d-aaccb04ed5f7","sequence":2},"memory_id":"6ed1c3bd-24d9-513e-9430-41ff147a11c8","namespace_id":"hmk:daimon-namespace:v1:0NTrertv2XdmcqsnmrpqYda-_HM0raLu3xJDLpgYfFo","projection_id":"hmk:daimon-projection:v1:AZYeQCkD6VagHm0WAjGogSf8kBVFiSjhh1cOMhNyX1w","source_checkpoint":{"hash":"71732bee4ad65d0a6c81e531652cd1326fea5845d90c656c65cb5e7ada433b89","sequence":2},"statement":{"byte_length":38,"classification":"protected","media_type":"text/plain","sha256":"4902923cb6d9befcee807bf8f87584ce8a803e1255cedbffc5f84eb15cd3f188"}},"idempotency_key":"vector:advance","namespace":{"generation":2,"manifest_hash":"53127a426eb2d5b8b9b7c086a76c12b2270a04eebcffd858838836dd129246ff","namespace_id":"hmk:daimon-namespace:v1:0NTrertv2XdmcqsnmrpqYda-_HM0raLu3xJDLpgYfFo","source_checkpoint":{"hash":"71732bee4ad65d0a6c81e531652cd1326fea5845d90c656c65cb5e7ada433b89","sequence":2}},"operation":"advance","outcome":"applied","previous":{"active":true,"author_me_id":"dm:being:v1:AAAAAAAAAAAAAAAAAAAAAAAAAAAAAAAAAAAAAAAAAAA","category":"personal-insight","head":{"event_hash":"83a637dd23ef611607c69eb5a2674fb858ed22819b20eb448469eb7af3b7da43","event_id":"a9f98b1d-115b-5979-b98d-88b8501667b6","sequence":1},"memory_id":"6ed1c3bd-24d9-513e-9430-41ff147a11c8","namespace_id":"hmk:daimon-namespace:v1:0NTrertv2XdmcqsnmrpqYda-_HM0raLu3xJDLpgYfFo","projection_id":"hmk:daimon-projection:v1:AZYeQCkD6VagHm0WAjGogSf8kBVFiSjhh1cOMhNyX1w","source_checkpoint":{"hash":"ebe3f0c9d7397378618fb27ccd9b767fc55112d101c9f1484bff3bae22f60383","sequence":1},"statement":{"byte_length":31,"classification":"protected","media_type":"text/plain","sha256":"f87db8f88c96dd7ad1cc111e9d6b806a48f3c387f1d59087b2c074d5a7b4b3f0"}},"receipt_id":"hmk:daimon-receipt:v1:k3qp3xtyEWnxrQuty-W7RUYaQLw9AsqeJ-gfYVbS4Qs","request_hash":"a3a5cd27049f8ddc90f8cfd90c25e24790781928623ab146b962619e2145f35b","request_id":"0f092ade-0369-55bb-ae7e-315b789952da","schema":"hmk.daimon-projection.receipt/v1","target":{"api_version":"1.0.0","instance_id":"hmk:vector-instance","schema_version":1}}
