{"current":{"active":true,"author_me_id":"dm:being:v1:AAAAAAAAAAAAAAAAAAAAAAAAAAAAAAAAAAAAAAAAAAA","category":"personal-insight","head":{"event_hash":"83a637dd23ef611607c69eb5a2674fb858ed22819b20eb448469eb7af3b7da43","event_id":"a9f98b1d-115b-5979-b98d-88b8501667b6","sequence":1},"memory_id":"6ed1c3bd-24d9-513e-9430-41ff147a11c8","namespace_id":"hmk:daimon-namespace:v1:0NTrertv2XdmcqsnmrpqYda-_HM0raLu3xJDLpgYfFo","projection_id":"hmk:daimon-projection:v1:AZYeQCkD6VagHm0WAjGogSf8kBVFiSjhh1cOMhNyX1w","source_checkpoint":{"hash":"ebe3f0c9d7397378618fb27ccd9b767fc55112d101c9f1484bff3bae22f60383","sequence":1},"statement":{"byte_length":31,"classification":"protected","media_type":"text/plain","sha256":"f87db8f88c96dd7ad1cc111e9d6b806a48f3c387f1d59087b2c074d5a7b4b3f0"}},"idempotency_key":"vector:project","namespace":{"generation":1,"manifest_hash":"baa2d31bc5905a28cf0687ce7e5f05dbe78d75958271c800dc26737ca070edda","namespace_id":"hmk:daimon-namespace:v1:0NTrertv2XdmcqsnmrpqYda-_HM0raLu3xJDLpgYfFo","source_checkpoint":{"hash":"ebe3f0c9d7397378618fb27ccd9b767fc55112d101c9f1484bff3bae22f60383","sequence":1}},"operation":"project","outcome":"applied","previous":null,"receipt_id":"hmk:daimon-receipt:v1:Ok4Bsbi04mi9P5Z39PpcmzKUkGTo92jCwOrn_sl5GjA","request_hash":"4a81357c901d0c57667f8bbf889e621085b503cda052a7aa4f915a174e08b2f8","request_id":"07a93487-ee36-5c92-887a-b0af1457026c","schema":"hmk.daimon-projection.receipt/v1","target":{"api_version":"1.0.0","instance_id":"hmk:vector-instance","schema_version":1}}
