{"current":{"active":false,"author_me_id":"dm:being:v1:AAAAAAAAAAAAAAAAAAAAAAAAAAAAAAAAAAAAAAAAAAA","category":"personal-insight","head":{"event_hash":"fa9714ca506313b210cc90f8da7f3ec2ecb09902ff9b5400c45017557fc32370","event_id":"2b36ce7d-722f-55b9-8161-66cda34b68b5","sequence":3},"memory_id":"6ed1c3bd-24d9-513e-9430-41ff147a11c8","namespace_id":"hmk:daimon-namespace:v1:0NTrertv2XdmcqsnmrpqYda-_HM0raLu3xJDLpgYfFo","projection_id":"hmk:daimon-projection:v1:AZYeQCkD6VagHm0WAjGogSf8kBVFiSjhh1cOMhNyX1w","source_checkpoint":{"hash":"2ac9e4e65b0f34e262b0977d263eb035e84c8e9fef673e64c5211c9738470655","sequence":3},"statement":{"byte_length":38,"classification":"protected","media_type":"text/plain","sha256":"4902923cb6d9befcee807bf8f87584ce8a803e1255cedbffc5f84eb15cd3f188"}},"idempotency_key":"vector:retract","namespace":{"generation":3,"manifest_hash":"4f53cda18c2baa0c0354bb5f9a3ecbe5ed12ab4d8e11ba873c2f11161202b945","namespace_id":"hmk:daimon-namespace:v1:0NTrertv2XdmcqsnmrpqYda-_HM0raLu3xJDLpgYfFo","source_checkpoint":{"hash":"2ac9e4e65b0f34e262b0977d263eb035e84c8e9fef673e64c5211c9738470655","sequence":3}},"operation":"retract","outcome":"applied","previous":{"active":true,"author_me_id":"dm:being:v1:AAAAAAAAAAAAAAAAAAAAAAAAAAAAAAAAAAAAAAAAAAA","category":"personal-insight","head":{"event_hash":"04912db95412c529e5dcdd57134568842f9a019f3da8460f325cd2558a030371","event_id":"d4747655-8c05-5935-810d-aaccb04ed5f7","sequence":2},"memory_id":"6ed1c3bd-24d9-513e-9430-41ff147a11c8","namespace_id":"hmk:daimon-namespace:v1:0NTrertv2XdmcqsnmrpqYda-_HM0raLu3xJDLpgYfFo","projection_id":"hmk:daimon-projection:v1:AZYeQCkD6VagHm0WAjGogSf8kBVFiSjhh1cOMhNyX1w","source_checkpoint":{"hash":"71732bee4ad65d0a6c81e531652cd1326fea5845d90c656c65cb5e7ada433b89","sequence":2},"statement":{"byte_length":38,"classification":"protected","media_type":"text/plain","sha256":"4902923cb6d9befcee807bf8f87584ce8a803e1255cedbffc5f84eb15cd3f188"}},"receipt_id":"hmk:daimon-receipt:v1:WmNJ9acHVc9h9mPRk8UU0mzTR_bOhG1XDlbLp-2j7uo","request_hash":"45b84d1baad4ca407d60463dd6b9491b2d2b8e95bc76ce88631bc5c701503aaf","request_id":"35feda60-0fb9-5712-86fc-566748a0d5d6","schema":"hmk.daimon-projection.receipt/v1","target":{"api_version":"1.0.0","instance_id":"hmk:vector-instance","schema_version":1}}
